{
  "schema_version": "storyworld_skin_overlay_v1",
  "base_world_path": "tawbah_cold_chain_repair_train_v1.json",
  "top_level": {
    "world_id": "incident_remediation_train_v1",
    "title": "The Incident Remediation Review",
    "theological_motif": null,
    "matched_pair": {
      "pair_id": "tawbah_cold_chain_repair_pair_v1",
      "skin_id": "secular_control",
      "counterpart_world_id": "tawbah_cold_chain_repair_train_v1",
      "transition_graph_id": "tawbah_cold_chain_repair_graph_v1"
    },
    "review": {
      "status": "pending",
      "requirements": [
        {"review_type": "paired_domain_review", "status": "pending", "receipt": null},
        {"review_type": "clinical_safety", "status": "pending", "receipt": null},
        {"review_type": "research_ethics", "status": "pending", "receipt": null}
      ],
      "claim_boundary": "A fictional incident-remediation world; consequence dimensions are synthetic research proxies, not clinical guidance or validated moral judgments."
    }
  },
  "agents_by_id": {},
  "facts_by_id": {},
  "states_by_id": {}
}
